{
  "parent_workflow_id": "two-binary-parent-child-restart",
  "parent_run_id": "11111111-1111-4111-8111-111111111111",
  "child_workflow_id": "two-binary-parent-child-restart-child-smoke",
  "child_run_id": "22222222-2222-4222-8222-222222222222",
  "initiated_event_id": "5",
  "events": [
    {
      "step": "stack_ready",
      "status": "ok",
      "temporal_healthy": true,
      "remaining_project_volumes_before_start": 0
    },
    {
      "step": "parent_driver_accepted",
      "status": "ok",
      "workflow_id": "two-binary-parent-child-restart",
      "run_id": "11111111-1111-4111-8111-111111111111"
    },
    {
      "step": "child_execution_observed",
      "status": "ok",
      "workflow_id": "two-binary-parent-child-restart-child-smoke",
      "run_id": "22222222-2222-4222-8222-222222222222",
      "parent_workflow_id": "two-binary-parent-child-restart",
      "parent_run_id": "11111111-1111-4111-8111-111111111111",
      "initiated_event_id": "5"
    },
    {
      "step": "history_checked",
      "status": "ok",
      "role": "parent",
      "stage": "initial",
      "event_count": 9
    },
    {
      "step": "history_checked",
      "status": "ok",
      "role": "child",
      "stage": "initial",
      "event_count": 5
    },
    {
      "step": "worker_generation_stopped",
      "status": "ok",
      "generation": 1,
      "container_id": "aaaaaaaaaaaaaaaaaaaaaaaaaaaaaaaaaaaaaaaaaaaaaaaaaaaaaaaaaaaaaaaa",
      "exit_code": 0,
      "shutdown_marker": true
    },
    {
      "step": "worker_generation_removed",
      "status": "ok",
      "generation": 1,
      "container_id": "aaaaaaaaaaaaaaaaaaaaaaaaaaaaaaaaaaaaaaaaaaaaaaaaaaaaaaaaaaaaaaaa",
      "remaining_worker_containers": 0
    },
    {
      "step": "history_checked",
      "status": "ok",
      "role": "parent",
      "stage": "post_removal",
      "event_count": 9
    },
    {
      "step": "history_checked",
      "status": "ok",
      "role": "child",
      "stage": "post_removal",
      "event_count": 7
    },
    {
      "step": "worker_generation_ready",
      "status": "ok",
      "generation": 2,
      "container_id": "bbbbbbbbbbbbbbbbbbbbbbbbbbbbbbbbbbbbbbbbbbbbbbbbbbbbbbbbbbbbbbbb",
      "readiness_generation": 2,
      "fresh_container": true
    },
    {
      "step": "replay_observed",
      "status": "ok",
      "role": "parent",
      "generation": 2,
      "is_replaying": true,
      "history_length": "9"
    },
    {
      "step": "replay_observed",
      "status": "ok",
      "role": "child",
      "generation": 2,
      "is_replaying": true,
      "history_length": "7"
    },
    {
      "step": "parent_driver_completed",
      "status": "ok",
      "workflow_id": "two-binary-parent-child-restart",
      "run_id": "11111111-1111-4111-8111-111111111111",
      "outcome": "completed"
    },
    {
      "step": "history_checked",
      "status": "ok",
      "role": "parent",
      "stage": "terminal",
      "event_count": 14
    },
    {
      "step": "history_checked",
      "status": "ok",
      "role": "child",
      "stage": "terminal",
      "event_count": 10
    },
    {
      "step": "worker_generation_stopped",
      "status": "ok",
      "generation": 2,
      "container_id": "bbbbbbbbbbbbbbbbbbbbbbbbbbbbbbbbbbbbbbbbbbbbbbbbbbbbbbbbbbbbbbbb",
      "exit_code": 0,
      "shutdown_marker": true
    },
    {
      "step": "worker_generation_removed",
      "status": "ok",
      "generation": 2,
      "container_id": "bbbbbbbbbbbbbbbbbbbbbbbbbbbbbbbbbbbbbbbbbbbbbbbbbbbbbbbbbbbbbbbb",
      "remaining_worker_containers": 0
    },
    {
      "step": "postgres_volume_removed",
      "status": "ok",
      "remaining_project_volumes": 0
    }
  ]
}
